{
  "schema_version": "1.0",
  "sample_source": "reviewed compiler and detector acceptance corpus; not a real-world precision sample",
  "sample_id": "test-integrity-rule-acceptance-v1",
  "rules": {
    "GOV-TESTS-001": {"reviewed_cases": 11, "true_positive": 3, "false_positive": 0, "true_negative": 8, "false_negative": 0, "decisions": [{"case_id": "positive-1", "classification": "true_positive"}, {"case_id": "positive-2", "classification": "true_positive"}, {"case_id": "positive-3", "classification": "true_positive"}, {"case_id": "negative-1", "classification": "true_negative"}, {"case_id": "negative-2", "classification": "true_negative"}, {"case_id": "negative-3", "classification": "true_negative"}, {"case_id": "negative-4", "classification": "true_negative"}, {"case_id": "negative-5", "classification": "true_negative"}, {"case_id": "negative-6", "classification": "true_negative"}, {"case_id": "negative-7", "classification": "true_negative"}, {"case_id": "negative-8", "classification": "true_negative"}]},
    "GOV-TESTS-002": {"reviewed_cases": 11, "true_positive": 3, "false_positive": 0, "true_negative": 8, "false_negative": 0, "decisions": [{"case_id": "positive-1", "classification": "true_positive"}, {"case_id": "positive-2", "classification": "true_positive"}, {"case_id": "positive-3", "classification": "true_positive"}, {"case_id": "negative-1", "classification": "true_negative"}, {"case_id": "negative-2", "classification": "true_negative"}, {"case_id": "negative-3", "classification": "true_negative"}, {"case_id": "negative-4", "classification": "true_negative"}, {"case_id": "negative-5", "classification": "true_negative"}, {"case_id": "negative-6", "classification": "true_negative"}, {"case_id": "negative-7", "classification": "true_negative"}, {"case_id": "negative-8", "classification": "true_negative"}]},
    "GOV-TESTS-003": {"reviewed_cases": 12, "true_positive": 4, "false_positive": 0, "true_negative": 8, "false_negative": 0, "decisions": [{"case_id": "positive-1", "classification": "true_positive"}, {"case_id": "positive-2", "classification": "true_positive"}, {"case_id": "positive-3", "classification": "true_positive"}, {"case_id": "positive-4", "classification": "true_positive"}, {"case_id": "negative-1", "classification": "true_negative"}, {"case_id": "negative-2", "classification": "true_negative"}, {"case_id": "negative-3", "classification": "true_negative"}, {"case_id": "negative-4", "classification": "true_negative"}, {"case_id": "negative-5", "classification": "true_negative"}, {"case_id": "negative-6", "classification": "true_negative"}, {"case_id": "negative-7", "classification": "true_negative"}, {"case_id": "negative-8", "classification": "true_negative"}]},
    "GOV-TESTS-004": {"reviewed_cases": 11, "true_positive": 3, "false_positive": 0, "true_negative": 8, "false_negative": 0, "decisions": [{"case_id": "positive-1", "classification": "true_positive"}, {"case_id": "positive-2", "classification": "true_positive"}, {"case_id": "positive-3", "classification": "true_positive"}, {"case_id": "negative-1", "classification": "true_negative"}, {"case_id": "negative-2", "classification": "true_negative"}, {"case_id": "negative-3", "classification": "true_negative"}, {"case_id": "negative-4", "classification": "true_negative"}, {"case_id": "negative-5", "classification": "true_negative"}, {"case_id": "negative-6", "classification": "true_negative"}, {"case_id": "negative-7", "classification": "true_negative"}, {"case_id": "negative-8", "classification": "true_negative"}]},
    "GOV-TESTS-005": {"reviewed_cases": 11, "true_positive": 3, "false_positive": 0, "true_negative": 8, "false_negative": 0, "decisions": [{"case_id": "positive-1", "classification": "true_positive"}, {"case_id": "positive-2", "classification": "true_positive"}, {"case_id": "positive-3", "classification": "true_positive"}, {"case_id": "negative-1", "classification": "true_negative"}, {"case_id": "negative-2", "classification": "true_negative"}, {"case_id": "negative-3", "classification": "true_negative"}, {"case_id": "negative-4", "classification": "true_negative"}, {"case_id": "negative-5", "classification": "true_negative"}, {"case_id": "negative-6", "classification": "true_negative"}, {"case_id": "negative-7", "classification": "true_negative"}, {"case_id": "negative-8", "classification": "true_negative"}]},
    "GOV-TESTS-006": {"reviewed_cases": 11, "true_positive": 3, "false_positive": 0, "true_negative": 8, "false_negative": 0, "decisions": [{"case_id": "positive-1", "classification": "true_positive"}, {"case_id": "positive-2", "classification": "true_positive"}, {"case_id": "positive-3", "classification": "true_positive"}, {"case_id": "negative-1", "classification": "true_negative"}, {"case_id": "negative-2", "classification": "true_negative"}, {"case_id": "negative-3", "classification": "true_negative"}, {"case_id": "negative-4", "classification": "true_negative"}, {"case_id": "negative-5", "classification": "true_negative"}, {"case_id": "negative-6", "classification": "true_negative"}, {"case_id": "negative-7", "classification": "true_negative"}, {"case_id": "negative-8", "classification": "true_negative"}]},
    "GOV-TESTS-010": {"reviewed_cases": 11, "true_positive": 3, "false_positive": 0, "true_negative": 8, "false_negative": 0, "decisions": [{"case_id": "positive-1", "classification": "true_positive"}, {"case_id": "positive-2", "classification": "true_positive"}, {"case_id": "positive-3", "classification": "true_positive"}, {"case_id": "negative-1", "classification": "true_negative"}, {"case_id": "negative-2", "classification": "true_negative"}, {"case_id": "negative-3", "classification": "true_negative"}, {"case_id": "negative-4", "classification": "true_negative"}, {"case_id": "negative-5", "classification": "true_negative"}, {"case_id": "negative-6", "classification": "true_negative"}, {"case_id": "negative-7", "classification": "true_negative"}, {"case_id": "negative-8", "classification": "true_negative"}]}
  }
}
